{
  "answers_per_minute": 1.0,
  "api_revision": "some string",
  "badges_per_minute": 1.0,
  "new_active_users": 1,
  "questions_per_minute": 1.0,
  "site": {
    "aliases": [
    ],
    "api_site_parameter": "some string",
    "audience": "some string",
    "closed_beta_date": 1,
    "favicon_url": "some string",
    "high_resolution_icon_url": "some string",
    "icon_url": "some string",
    "launch_date": 1,
    "logo_url": "some string",
    "markdown_extensions": [
    ],
    "name": "some string",
    "open_beta_date": 1,
    "related_sites": [
    ],
    "site_state": "some string",
    "site_type": "some string",
    "site_url": "some string",
    "styling": {
      "link_color": "some string",
      "tag_background_color": "some string",
      "tag_foreground_color": "some string"
    },
    "twitter_account": "some string"
  },
  "total_accepted": 1,
  "total_answers": 1,
  "total_badges": 1,
  "total_comments": 1,
  "total_questions": 1,
  "total_unanswered": 1,
  "total_users": 1,
  "total_votes": 1
}